944,Pasteuria Bioscience,Crops,Biotech,United States,"Advantage Capital, Florida Gulfshore Capital, Life Sciences Partners, Sid Martin Biotechnology Incubator, Gordon River Capital, Syngenta",10.95,United States,US,USA,840,ISO 3166-2:US,Americas,Northern America,19,21,10950000,North America
945,PATS,Crops,Monitoring & Management,Netherlands,UNIIQ,0.27,Netherlands,NL,NLD,528,ISO 3166-2:NL,Europe,Western Europe,150,155,270000,Europe
946,Pattern,Crops,Monitoring & Management,United States,"Founders Fund, International Finance Corporation, Ospraie Ag Science, Valor Capital Group, The Nature Conservancy, LAUNCH, iSelect Fund",29.03,United States,US,USA,840,ISO 3166-2:US,Americas,Northern America,19,21,29030000,North America
947,Peace of Meat,"Livestock, Poultry, & Meats",Biotech,Belgium,"Big Idea Ventures, Social Starts, Joyance Partners, Meat-Tech",1.3,Belgium,BE,BEL,56,ISO 3166-2:BE,Europe,Western Europe,150,155,1300000,Europe
948,Peas & Love,Crops,Business Planning & Finance,Belgium,Eutopia,2.61,Belgium,BE,BEL,56,ISO 3166-2:BE,Europe,Western Europe,150,155,2610000,Europe
949,PEAT,Crops,Monitoring & Management,Germany,"Merck Accelerator, Atlantic Labs, Index Ventures, Piton Capital, RTP Global",8.36,Germany,DE,DEU,276,ISO 3166-2:DE,Europe,Western Europe,150,155,8360000,Europe
950,Pent Ranch,Multi-faceted,Business Planning & Finance,Ghana,Standard Chartered Women in Technology Incubator,0.01,Ghana,GH,GHA,288,ISO 3166-2:GH,Africa,Africa,2,11,10000,Africa
951,Pentalum Technologies,Multi-faceted,Business Planning & Finance,Israel,"Cedar Fund, Evergreen Venture Partners, ABB Technology Ventures, Threshold Ventures, Bright Capital, GE Ventures",22.5,Israel,IL,ISR,376,ISO 3166-2:IL,Asia,Western Asia,142,145,22500000,Asia
952,Pepper Farms,Multi-faceted,Business Planning & Finance,India,"Axilor Venture Capital, Himanshu Aggarwal, Rahul Jain, Raman Uberoi, Sunil Kalra, Tarun Khanna",1,India,IN,IND,356,ISO 3166-2:IN,Asia,Southern Asia,142,34,1000000,Asia
953,Perfect Day,"Livestock, Poultry, & Meats",Biotech,United States,"Horizons Ventures, RebelBio, SOSV, B37 Ventures, Conti Ventures, ICONIQ Capital, Lion Ventures, Temasek, Verus International, ADM Ventures, CPP Investments, Bob Iger, SK Inc.",723.24,United States,US,USA,840,ISO 3166-2:US,Americas,Northern America,19,21,723240000,North America
954,Performance Livestock Analytics,"Livestock, Poultry, & Meats",Monitoring & Management,United States,"Builders VC, Cavallo Ventures, Pappajohn Iowa Entrepreneurial Venture Competition, Zoetis",2.28,United States,US,USA,840,ISO 3166-2:US,Americas,Northern America,19,21,2280000,North America
955,Performance Plants,Crops,Biotech,Canada,"Sustainable Development Technology Canada, Dynex Capital, Golden Opportunities Fund, Investment Saskatchewan, VentureLink",15.97,Canada,CA,CAN,124,ISO 3166-2:CA,Americas,Northern America,19,21,15970000,North America
956,Pevesa,Crops,Biotech,Spain,"Caixa Capital Risc, Milar Ventures, Suanfarma, Kerry Group",2.05,Spain,ES,ESP,724,ISO 3166-2:ES,Europe,Southern Europe,150,39,2050000,Europe
957,PhageLux,Crops,Biotech,China,"WuXi Healthcare Ventures, Fosun Pharmaceutical",10,China,CN,CHN,156,ISO 3166-2:CN,Asia,Eastern Asia,142,30,10000000,Asia
958,Phenomics Labs,Crops,Monitoring & Management,United States,Iowa AgriTech Accelerator,0.04,United States,US,USA,840,ISO 3166-2:US,Americas,Northern America,19,21,40000,North America
959,Pheronym,Crops,Biotech,United States,"IndieBio, SOSV, National Science Foundation, Mark Haney, Monte Bottens, Pam Marrone, Sacramento Angels",0.67,United States,US,USA,840,ISO 3166-2:US,Americas,Northern America,19,21,670000,North America
960,Phinite,Multi-faceted,Biotech,United States,"RIoT Accelerator Program, Ag Startup Engine",0.35,United States,US,USA,840,ISO 3166-2:US,Americas,Northern America,19,21,350000,North America
961,Phospholutions,Crops,Biotech,United States,"Ben Franklin Technology Partners of Central & Northern PA, 1855 Capital, Maumee Ventures, Ag Ventures Alliance, Conti Ventures, Tekfen Ventures",13.8,United States,US,USA,840,ISO 3166-2:US,Americas,Northern America,19,21,13800000,North America
962,Phylos,Crops,Biotech,United States,"Accomplice, Entourage Effect Capital, Merida Capital Partners",26.21,United States,US,USA,840,ISO 3166-2:US,Americas,Northern America,19,21,26210000,North America
963,Phytech,Crops,Monitoring & Management,Israel,"Mitsui & Co., Syngenta Ventures, Tencent Holdings, Thomas H. Lee Partners, Yellow Brick Capital",34.5,Israel,IL,ISR,376,ISO 3166-2:IL,Asia,Western Asia,142,145,34500000,Asia
964,Phytelligence,Crops,Biotech,United States,"Cowles Company, Rio Investment Partners, WRF Capital",20.01,United States,US,USA,840,ISO 3166-2:US,Americas,Northern America,19,21,20010000,North America
965,Phytoform Labs,Crops,Biotech,United Kingdom,"Backed VC, Eniac Ventures, FTW Ventures, Fine Structure Ventures, Ian Hogarth, Jeff Dean, Pale Blue Dot, Refactor Capital, Wireframe Ventures",11.35,United Kingdom,GB,GBR,826,ISO 3166-2:GB,Europe,Northern Europe,150,154,11350000,Europe
966,Phytoponics,Crops,Monitoring & Management,United Kingdom,"Startupbootcamp FoodTech, EIT Food, David Kremer, Melisa Lawton, Smart Anchor Ventures, Development Bank of Wales",1.3,United Kingdom,GB,GBR,826,ISO 3166-2:GB,Europe,Northern Europe,150,154,1300000,Europe
967,PickApp,Crops,Monitoring & Management,Israel,MassChallenge,6,Israel,IL,ISR,376,ISO 3166-2:IL,Asia,Western Asia,142,145,6000000,Asia
968,PickTrace,Crops,Business Planning & Finance,United States,"Y Combinator, FundersClub",0.12,United States,US,USA,840,ISO 3166-2:US,Americas,Northern America,19,21,120000,North America
969,Pink Farms,Crops,Monitoring & Management,Brazil,"Capital Lab, SP Ventures, SMU Investimentos, Grao",1.38,Brazil,BR,BRA,76,ISO 3166-2:BR,Americas,South America,19,5,1380000,South America
970,Pinnacle Agriculture Holdings,Crops,Distribution & Sales,United States,,1.4,United States,US,USA,840,ISO 3166-2:US,Americas,Northern America,19,21,1400000,North America
971,Pivot Bio,Crops,Biotech,United States,"Monsanto Growth Ventures, Bill & Melinda Gates Foundation, Data Collective, Prelude Ventures, Spruce Capital Partners, Breakthrough Energy Ventures, Temasek, Alan Cohen, Bunge Ventures, Codon Capital, Conti Ventures, Pavilion Capital, Roger Underwood, Tekfen Ventures, G2 Ventures, Generation Investment Management, Rockefeller Capital Management, Thia Ventures, BNEF Pioneer Program",616.75,United States,US,USA,840,ISO 3166-2:US,Americas,Northern America,19,21,616750000,North America
972,Planet Based Foods,"Livestock, Poultry, & Meats",Biotech,United States,,0.3,United States,US,USA,840,ISO 3166-2:US,Americas,Northern America,19,21,300000,North America
973,Planet Table,Multi-faceted,Distribution & Sales,Japan,"CyberAgent Capital, Saison Ventures, Genuine Startups, Mistletoe, SBI Investment, Daiwa Securities Group, Spiral Ventures",10.21,Japan,JP,JPN,392,ISO 3166-2:JP,Asia,Eastern Asia,142,30,10210000,Asia
974,Plant Response,Crops,Biotech,United States,"Caixa Capital Risc, Monsanto Growth Ventures, Bayer Growth Ventures, Middleland Capital, Novozymes, Yara Growth Ventures, iSelect Fund, The Mosaic Company",90.84,United States,US,USA,840,ISO 3166-2:US,Americas,Northern America,19,21,90840000,North America
975,Plant-based Japan,"Livestock, Poultry, & Meats",Biotech,Japan,Proveg Incubator,0.02,Japan,JP,JPN,392,ISO 3166-2:JP,Asia,Eastern Asia,142,30,20000,Asia
976,PlantArcBio,Crops,Biotech,Israel,Israel Innovation Authority,3,Israel,IL,ISR,376,ISO 3166-2:IL,Asia,Western Asia,142,145,3000000,Asia
977,Planted,"Livestock, Poultry, & Meats",Biotech,Switzerland,">>venture>>, Kickstart Accelerator, Blue Horizon ex Ventures, ETH Foundation, Good Seed Ventures, Hiltl, Josef Bieri, Mica Ventures, Philippe Gaydoul, Social Starts, Stephan Schmidheiny Family, Swiss Startup Capital Investors Club, Ze.Pharm Trust, Venture Kick, Blue Horizon Ventures, Gaydoul Group, Vorwerk Ventures, Yann Sommer, ETH Zurich, ACE & Company, Be8, Movendo Capital, Refood Invest",44.21,Switzerland,CH,CHE,756,ISO 3166-2:CH,Europe,Western Europe,150,155,44210000,Europe
978,PLANTIO,Crops,Monitoring & Management,Japan,"Canal Ventures, Genesia Ventures, JA Mitsui Leasing, Tokyu Fudosan Holdings, MYFARM, Daiko Advertising, MS-Japan, iSGS Investment Works",4.62,Japan,JP,JPN,392,ISO 3166-2:JP,Asia,Eastern Asia,142,30,4620000,Asia
979,Plantish,Fishing & Seafood,Biotech,Israel,"VegInvest, Alumni Ventures Group, E2JDJ, FoodHack, OurCrowd, Pitango Venture Capital, Smart Agro Fund, State of Mind Ventures, TechAviv Founder Partners, Unovis Asset Management",14.5,Israel,IL,ISR,376,ISO 3166-2:IL,Asia,Western Asia,142,145,14500000,Asia
980,PlantSnap,Crops,Monitoring & Management,United States,WeFunder,0.13,United States,US,USA,840,ISO 3166-2:US,Americas,Northern America,19,21,130000,North America
981,Planty AI,Crops,Monitoring & Management,Romania,AgTech TM,0.1,Romania,RO,ROU,642,ISO 3166-2:RO,Europe,Eastern Europe,150,151,100000,Europe
982,Plastomics,Crops,Biotech,United States,"BioGenerator, The Yield Lab, Technology Acceleration Partners, St. Louis Arch Angels, Missouri Technology Corporation, St. Louis Economic Development Partnership, National Science Foundation, Wells Fargo Innovation Incubator, iSelect Fund, Centennial Investors, Fulcrum Global Capital, GIS Strategic Ventures, Innovation in Motion, Lewis & Clark Ventures, Prolog Ventures, Revolution Rise Of The Rest Seed Fund, Yield Lab Europe",13.67,United States,US,USA,840,ISO 3166-2:US,Americas,Northern America,19,21,13670000,North America
983,Platfarm,Crops,Monitoring & Management,Israel,"Techstars, Start-Up Chile",0.16,Israel,IL,ISR,376,ISO 3166-2:IL,Asia,Western Asia,142,145,160000,Asia
984,Plenty,Crops,Monitoring & Management,United States,"DCM Ventures, Finistere Ventures, Bezos Expeditions, Innovation Endeavors, Data Collective, Group 11, SoftBank Group, Driscoll's, JS Capital, One Madison, Walmart",935,United States,US,USA,840,ISO 3166-2:US,Americas,Northern America,19,21,935000000,North America
985,Pocket Marche,Multi-faceted,Distribution & Sales,Japan,"Euglena, Inspire PNB Partners, Mercari Fund, Dentsu Group, Iwagin Jigyo Souzou Capital, Kobashi Industries, OKB Capital, MAKOTO Capital, Marui Group, Orange Page, Setouchi DMO, Norinchukin Bank",14.12,Japan,JP,JPN,392,ISO 3166-2:JP,Asia,Eastern Asia,142,30,14120000,Asia
986,Pollen Systems,Crops,Monitoring & Management,United States,"Alliance of Angels, Keiretsu Forum",1.03,United States,US,USA,840,ISO 3166-2:US,Americas,Northern America,19,21,1030000,North America
987,Polynatural,Crops,Packing & Supply Chain,Chile,"The Yield Lab, Alerce, Chile Global Ventures",0.9,Chile,CL,CHL,152,ISO 3166-2:CL,Americas,South America,19,5,900000,South America
988,Poseidon-AI,Fishing & Seafood,Monitoring & Management,Singapore,"HAX, SOSV, Entrepreneur First",0.08,Singapore,SG,SGP,702,ISO 3166-2:SG,Asia,South-Eastern Asia,142,35,80000,Asia
989,Potbotics,Crops,Monitoring & Management,United States,,2.36,United States,US,USA,840,ISO 3166-2:US,Americas,Northern America,19,21,2360000,North America
990,Power Pollen,Crops,Biotech,United States,"Pappajohn Iowa Entrepreneurial Venture Competition, Paycheck Protection Program, Ag Ventures Alliance, Iowa Corn Growers Association",15.22,United States,US,USA,840,ISO 3166-2:US,Americas,Northern America,19,21,15220000,North America
991,Precision AI,Crops,Monitoring & Management,Canada,"At One Ventures, BDC Capital, Fulcrum Global Capital, Golden Opportunities Fund, Protein Industries Canada, Sustainable Development Technology Canada",16.24,Canada,CA,CAN,124,ISO 3166-2:CA,Americas,Northern America,19,21,16240000,North America
992,PrecisionHawk,Crops,Monitoring & Management,United States,"Bob Young, Innovate Indiana Fund, Millennium Technology Value Partners, Intel Capital, DuPont, NTT DoCoMo Ventures, USAA Ventures, Verizon Ventures, Yamaha Motor Ventures, Comcast Ventures, Constellation Technology Ventures, Senator Investment Group, Syngenta Ventures, Third Point Ventures, Eastward Capital Partners, Paycheck Protection Program",141.89,United States,US,USA,840,ISO 3166-2:US,Americas,Northern America,19,21,141890000,North America
993,Premier Crop Systems,Crops,Monitoring & Management,United States,"Syngenta Ventures, Paycheck Protection Program",5.33,United States,US,USA,840,ISO 3166-2:US,Americas,Northern America,19,21,5330000,North America
994,Pricepally,Multi-faceted,Distribution & Sales,Nigeria,"Westerwelle Young Founders Program, Wimbart, GreenTec Capital Partners, Urban Innovation Challenge, Launch Africa, Samurai Incubate, Chinaccelerator, SOSV, MOX",0.3,Nigeria,NG,NGA,566,ISO 3166-2:NG,Africa,Africa,2,11,300000,Africa
995,Pro Solus,Crops,Monitoring & Management,Brazil,GEF Capital Partners,15,Brazil,BR,BRA,76,ISO 3166-2:BR,Americas,South America,19,5,15000000,South America
996,ProcSea,Fishing & Seafood,Distribution & Sales,France,"Business Angels Switzerland, Polytech Ventures, Swiss ICT Investor Club, FJ Labs, Piton Capital, Samaipata Ventures, Alpana Ventures, CapHorn Invest, Serena Capital, SAP.iO Foundry Paris",11.04,France,FR,FRA,250,ISO 3166-2:FR,Europe,Western Europe,150,155,11040000,Europe
997,ProDealCenter,Multi-faceted,Business Planning & Finance,France,Omnes Capital,1.35,France,FR,FRA,250,ISO 3166-2:FR,Europe,Western Europe,150,155,1350000,Europe
998,Produce Pay,Multi-faceted,Business Planning & Finance,United States,"500 Global, Arena Ventures, Red Bear Angels, Social Leverage, TYLT Lab, Wonder Ventures, CoVenture, Menlo Ventures, Anterra Capital, FJ Labs, GreenHouse Capital, Moonshots Capital, Rabo Frontier Ventures, Tribeca Early Stage Partners, TCM Global Asset Management, Paycheck Protection Program, Astanor Ventures, Finistere Ventures, G2VP, IDB Invest, Ignia Fund, International Finance Corporation",327.18,United States,US,USA,840,ISO 3166-2:US,Americas,Northern America,19,21,327180000,North America
999,Produquimica Industria e Comercio,Crops,Biotech,Brazil,Compass Minerals,115.9,Brazil,BR,BRA,76,ISO 3166-2:BR,Americas,South America,19,5,115900000,South America
1000,Proeon,"Livestock, Poultry, & Meats",Biotech,India,"PitchRight Ventures, Flow State Ventures, OmniActive Health Technologies, Peak Venture Partners, Sanjaya Mariwala, Shaival Desai, Waoo Partners",2.4,India,IN,IND,356,ISO 3166-2:IN,Asia,Southern Asia,142,34,2400000,Asia
1001,Prolein,"Livestock, Poultry, & Meats",Biotech,France,"Avril, Bpifrance",52.77,France,FR,FRA,250,ISO 3166-2:FR,Europe,Western Europe,150,155,52770000,Europe
1002,Prolupin,Crops,Biotech,Germany,"7Life, Munich Venture Partners, PESCH, Tate & Lyle Ventures, eCapital entrepreneurial Partners, Capricorn Partners, Novax, Quest for Growth, European Circular Bioeconomy Fund",15.3,Germany,DE,DEU,276,ISO 3166-2:DE,Europe,Western Europe,150,155,15300000,Europe
1003,Promip,Crops,Biotech,Brazil,SP Ventures,1.7,Brazil,BR,BRA,76,ISO 3166-2:BR,Americas,South America,19,5,1700000,South America
1004,ProProtein,"Livestock, Poultry, & Meats",Biotech,Estonia,Proveg Incubator,0.02,Estonia,EE,EST,233,ISO 3166-2:EE,Europe,Northern Europe,150,154,20000,Europe
1005,Prospera Technologies,Crops,Monitoring & Management,Israel,"Bessemer Venture Partners, Hishtil, Cisco Investments, MoreVC, Qualcomm Ventures, Tekfen Ventures, Valmont Industries",22,Israel,IL,ISR,376,ISO 3166-2:IL,Asia,Western Asia,142,145,22000000,Asia
1006,Protealis,Crops,Biotech,Belgium,"Colruyt Group, Innovation Industries, Thia Ventures, Agri Investment Fund, Estari, Gemma Frisius Fund KU Leuven (GFF), Globachem, PMV, VIB, ILVO",13.9,Belgium,BE,BEL,56,ISO 3166-2:BE,Europe,Western Europe,150,155,13900000,Europe
1007,Proteinea,Crops,Monitoring & Management,Egypt,"Changelabs, Hub71, IndieBio, SOSV",0.09,Egypt,EG,EGY,818,ISO 3166-2:EG,Africa,Africa,2,15,90000,Africa
1008,Protera,"Livestock, Poultry, & Meats",Biotech,France,"SOSV, Sofinnova Partners, Bimbo Ventures, ICL Group",12.35,France,FR,FRA,250,ISO 3166-2:FR,Europe,Western Europe,150,155,12350000,Europe
1009,Protix,"Livestock, Poultry, & Meats",Monitoring & Management,Netherlands,"Brabant Life Sciences Seed Fund, Dutch Greentech Fund, Aqua-Spark, BOM Brabant Ventures, Rabobank, Invest-NL, BNP Paribas, European Circular Bioeconomy Fund, Prince Albert II Foundation, Rabo Investments, The Good Investors",126.2,Netherlands,NL,NLD,528,ISO 3166-2:NL,Europe,Western Europe,150,155,126200000,Europe
1010,ProvEye,Crops,Monitoring & Management,Ireland,"Enterprise Ireland, Horizon 2020, AgTechUCD Agccelerator Programme",0.04,Ireland,IE,IRL,372,ISO 3166-2:IE,Europe,Northern Europe,150,154,40000,Europe
1011,Provision Analytics,Crops,Packing & Supply Chain,Canada,"FoodTrack by Maersk, Protein Industries Canada, Builders VC, Creative Destruction Lab, TrustBIX, Level 46 Investments, Serra Ventures, Trailhead Capital, Voyager Capital, Waterpoint Lane",7.05,Canada,CA,CAN,124,ISO 3166-2:CA,Americas,Northern America,19,21,7050000,North America
1012,Provivi,Crops,Biotech,United States,"Spruce Capital Partners, Xeraya Capital, BASF Venture Capital, Kairos Ventures, Pioneer, Lanx Capital, Pontifax AgTech, Tybourne Capital Management, Horizon Technology Finance, Paycheck Protection Program, Temasek, Vivo Capital, Bill & Melinda Gates Foundation",209.92,United States,US,USA,840,ISO 3166-2:US,Americas,Northern America,19,21,209920000,North America
1013,Pula,Multi-faceted,Business Planning & Finance,Switzerland,"Digital Financial Service Lab, Accion, Choiseul Africa Capital, Flourish Ventures, Mercy Corps, Mulago Foundation, Mastercard Foundation, Women's World Banking, Omidyar Network, TLcom Capital",9.1,Switzerland,CH,CHE,756,ISO 3166-2:CH,Europe,Western Europe,150,155,9100000,Europe
1014,Pulse Aerospace,Crops,Monitoring & Management,United States,AeroVironment,21.22,United States,US,USA,840,ISO 3166-2:US,Americas,Northern America,19,21,21220000,North America
1015,Pura Organic,Crops,Packing & Supply Chain,Uganda,Pearl Capital Partners,2.5,Uganda,UG,UGA,800,ISO 3166-2:UG,Africa,Eastern Africa,2,14,2500000,Africa
1016,Pure Harvest Smart Farms,Crops,Monitoring & Management,United Arab Emirates,"Shorooq Partners, Wafra International Investment, Abu Dhabi Investment Office, SHUAA Capital, Sancta Capital, IMM Investment",152.45,United Arab Emirates,AE,ARE,784,ISO 3166-2:AE,Asia,Western Asia,142,145,152450000,Asia
1017,PureSense,Crops,Monitoring & Management,United States,"One Earth Capital, Jain Irrigation",10.3,United States,US,USA,840,ISO 3166-2:US,Americas,Northern America,19,21,10300000,North America
1018,Puris Proteins,Crops,Biotech,United States,"Cargill, Charles Chang, Siddhi Capital, Paycheck Protection Program, Portland Private Equity",153.18,United States,US,USA,840,ISO 3166-2:US,Americas,Northern America,19,21,153180000,North America
1019,Pursell Agri-Tech,Crops,Monitoring & Management,United States,"RezVen Partners, Paycheck Protection Program",10.15,United States,US,USA,840,ISO 3166-2:US,Americas,Northern America,19,21,10150000,North America
1020,Pycno,Crops,Monitoring & Management,United Kingdom,"Launch KC, HAX, FoodBytes!, IMPACT Accelerator",0.19,United Kingdom,GB,GBR,826,ISO 3166-2:GB,Europe,Northern Europe,150,154,190000,Europe
1021,Pyka,Crops,Monitoring & Management,United States,"Y Combinator, Zillionize Angel, BOLD Capital Partners, Data Collective, Greycroft, Prime Movers Lab",11.12,United States,US,USA,840,ISO 3166-2:US,Americas,Northern America,19,21,11120000,North America
1022,Quantified AG,"Livestock, Poultry, & Meats",Monitoring & Management,United States,"Invest Nebraska, gBETA, Merck Animal Health",2.92,United States,US,USA,840,ISO 3166-2:US,Americas,Northern America,19,21,2920000,North America
1023,Quick Plug Canada,Crops,Monitoring & Management,Canada,Southwestern Ontario Development Fund,0.37,Canada,CA,CAN,124,ISO 3166-2:CA,Americas,Northern America,19,21,370000,North America
1024,R-Sept,"Livestock, Poultry, & Meats",Monitoring & Management,Russian Federation,"Eduard Gurinovich, Sergei Eremin",0.17,Russian Federation,RU,RUS,643,ISO 3166-2:RU,Europe,Eastern Europe,150,151,170000,Europe
1025,Rabbit Tractors,Crops,Monitoring & Management,United States,"Iowa AgriTech Accelerator, AgLaunch, Innova Memphis",0.04,United States,US,USA,840,ISO 3166-2:US,Americas,Northern America,19,21,40000,North America
1026,Rainfed Foods,"Livestock, Poultry, & Meats",Biotech,Canada,GROW,0.2,Canada,CA,CAN,124,ISO 3166-2:CA,Americas,Northern America,19,21,200000,North America
1027,Rakr,Multi-faceted,Monitoring & Management,Canada,"Capital Innovators, Japfa Feeds the Future",0.1,Canada,CA,CAN,124,ISO 3166-2:CA,Americas,Northern America,19,21,100000,North America
1028,Raks Agricultural Technology,Crops,Monitoring & Management,Brazil,"Iowa AgriTech Accelerator, WE IMPACT",0.04,Brazil,BR,BRA,76,ISO 3166-2:BR,Americas,South America,19,5,40000,South America
1029,Rantizo,Crops,Monitoring & Management,United States,"Innova Memphis, Pappajohn Iowa Entrepreneurial Venture Competition, AgLaunch, Ag Ventures Alliance, Fall Line Capital, ISA Ventures, KZValve, Leaps by Bayer, Lewis & Clark Ventures, Sukup Manufacturing",8.04,United States,US,USA,840,ISO 3166-2:US,Americas,Northern America,19,21,8040000,North America
1030,Rapid Diagnostek,Multi-faceted,Packing & Supply Chain,United States,"Peak Ridge Capital, Capital Midwest Fund, NEW Capital Fund, Space Center Ventures, TGap Ventures",12.8,United States,US,USA,840,ISO 3166-2:US,Americas,Northern America,19,21,12800000,North America
1031,RapidGrow LED Technologies,Crops,Monitoring & Management,United States,,4.57,United States,US,USA,840,ISO 3166-2:US,Americas,Northern America,19,21,4570000,North America
1032,Raptor Maps,Crops,Monitoring & Management,United States,"MIT 100K Entrepreneurship Competition, Founder.org, Y Combinator, Commercial Drone Fund, Powerhouse Ventures, Cascade Global, Blue Bear Capital, Congruent Ventures, Paycheck Protection Program, Buoyant Ventures, Data Point Capital, Massachusetts Clean Energy Center, Massachusetts Institute of Technology",5.97,United States,US,USA,840,ISO 3166-2:US,Americas,Northern America,19,21,5970000,North America
1033,Re-Nuble,Crops,Biotech,United States,"Food-X, 1776, THRIVE Accelerator, SOSV, SVG Ventures, Global Sustainable Future, She1K, WOCstar Fund",1.8,United States,US,USA,840,ISO 3166-2:US,Americas,Northern America,19,21,1800000,North America
1034,Real Filling,Multi-faceted,Distribution & Sales,United States,,0.04,United States,US,USA,840,ISO 3166-2:US,Americas,Northern America,19,21,40000,North America
1035,Real Leaf Farm,Crops,Monitoring & Management,Ireland,"Government of Ireland, Accelerate Green",1.23,Ireland,IE,IRL,372,ISO 3166-2:IE,Europe,Northern Europe,150,154,1230000,Europe
1036,RealmFive,Crops,Monitoring & Management,United States,"Invest Nebraska, Open Prairie Ventures, Paycheck Protection Program",2.75,United States,US,USA,840,ISO 3166-2:US,Americas,Northern America,19,21,2750000,North America
1037,Red Sea Farms,Crops,Monitoring & Management,Saudi Arabia,"KAUST Innovation Fund, Research Products Development Company, FoodTech Challenge, Future Investment Initiative Institute, Global Ventures, King Abdullah University of Science and Technology, Wa'ed Ventures, AppHarvest, Bonaventure Capital",17.9,Saudi Arabia,SA,SAU,682,ISO 3166-2:SA,Asia,Western Asia,142,145,17900000,Asia
1038,Redag Crop Production,Crops,Biotech,United Kingdom,"North West Fund for Venture Capital, Acceleris Capital",2,United Kingdom,GB,GBR,826,ISO 3166-2:GB,Europe,Northern Europe,150,154,2000000,Europe
1039,Redefine Meat,Crops,Biotech,Israel,"CPT Capital, Hanaco Venture Capital, PHW, EIT Food, FoodBytes!, Happiness Capital, K3 Ventures, Losa Group, Sake Bosch, Hanaco Ventures, Synthesis Capital",170.07,Israel,IL,ISR,376,ISO 3166-2:IL,Asia,Western Asia,142,145,170070000,Asia
1040,Reeldata,Fishing & Seafood,Monitoring & Management,Canada,"Volta Labs, Innovacorp Sprint Competition, Techstars, StartupYard, MassChallenge, S2G Ventures, Sustainable Development Technology Canada",2.6,Canada,CA,CAN,124,ISO 3166-2:CA,Americas,Northern America,19,21,2600000,North America
1041,reHarvest Provisions,Crops,Distribution & Sales,United States,"Captra Capital, Chicago Early Growth Ventures, Dobson Avenue, Flagstaff Ventures, Segal Ventures, True Wealth Ventures",1.5,United States,US,USA,840,ISO 3166-2:US,Americas,Northern America,19,21,1500000,North America
1042,Releaf,Crops,Distribution & Sales,Nigeria,"Y Combinator, Harambeans, Future Africa, African Development Bank Group, Endeavor, Consonance Investment Managers, Justin Kan, Samurai Incubate, Stephen Pagliuca, Challenge Fund for Youth Employment, U.S. Agency for International Development, Eudaimonia Capital, Africa's Business Heroes",5.04,Nigeria,NG,NGA,566,ISO 3166-2:NG,Africa,Africa,2,11,5040000,Africa
1043,Resson,Crops,Monitoring & Management,Canada,"BDC Venture Capital, Build Ventures, New Brunswick Innovation Foundation, Rho Canada, BDC Capital, East Valley Ventures, Monsanto Growth Ventures, Mahindra Group, McCain Foods, Opportunities NB",25.16,Canada,CA,CAN,124,ISO 3166-2:CA,Americas,Northern America,19,21,25160000,North America
1044,Revo Foods,Fishing & Seafood,Biotech,Austria,"StartLife, Hazelpond Capital, MKO Holdings, friends2grow",1.88,Austria,AT,AUT,40,ISO 3166-2:AT,Europe,Western Europe,150,155,1880000,Europe
1045,Revol Greens,Crops,Monitoring & Management,United States,Equilibrium Capital Partners,68,United States,US,USA,840,ISO 3166-2:US,Americas,Northern America,19,21,68000000,North America
1046,Revotree,Crops,Monitoring & Management,Italy,LUISS ENLABS,0.08,Italy,IT,ITA,380,ISO 3166-2:IT,Europe,Southern Europe,150,39,80000,Europe
1047,Rezatec,Multi-faceted,Monitoring & Management,United Kingdom,"HBS Alumni Angels Association, Run Capital, Caphaven, Newable, Harbert European Growth Capital, Gresham House Ventures",10.7,United Kingdom,GB,GBR,826,ISO 3166-2:GB,Europe,Northern Europe,150,154,10700000,Europe
