628,GrubMarket,Multi-faceted,Distribution & Sales,United States,"Danhua Capital, Fusion Fund, GGV Capital, Gang Wang, Jerry Yang, Y Combinator, ACE & Company, AME Cloud Ventures, Battery Ventures, Fosun RZ Capital, Fabrice Grinda, GWC Innovator Fund, Global Founders Capital, Reindeer Investments, Riverhead Capital, Sound Ventures, Great Oaks Venture Capital, Alumni Ventures Group, Castor Ventures, Investwide Capital, Max Ventures, Millennium Technology Value Partners, Trinity Capital Investment, Arancia, Bascom Ventures, CentreGold Capital, DG Ventures, Evolv Ventures, University Growth Fund, WI Harper Group, Paycheck Protection Program, BlackRock, Celtic House Venture Partners, Digital Garage, Marubeni Ventures, Mojo Partners, Reimagined Ventures, Scrum Ventures, Sixty Degree Capital, Celtic House Asia Partners, Madison Bay Capital Partners, The Strand Partners, Gaingels, INP Capital, Japan Post Capital, Joseph Stone Capital, Liberty Street Funds, Moringa Fund, Pegasus Tech Ventures, Tech Pioneers Fund, Walleye Capital, Apeira Capital, Post Capital Partners, Tiger Global Management, We Capital",396.06,United States,US,USA,840,ISO 3166-2:US,Americas,Northern America,19,21,396060000,North America
629,Gryllus,,Distribution & Sales,Japan,"Academia Industry Alliance Capital, Beyond Next Ventures, HOXIN, Future Venture Capital, Iyogin Capital, Kintetsu Venture Partners, kemuri ventures",4.7,Japan,JP,JPN,392,ISO 3166-2:JP,Asia,Eastern Asia,142,30,4700000,Asia
630,Guardian Agriculture,Crops,Monitoring & Management,United States,"Cavallo Ventures, E14 Fund, FMC Ventures, Fall Line Capital, Leaps by Bayer, Neoteny, Pillar",15.5,United States,US,USA,840,ISO 3166-2:US,Americas,Northern America,19,21,15500000,North America
631,Gushengmi,Crops,Biotech,China,"Guyin Capital, Haoxin Capital, Wei Wang",1.55,China,CN,CHN,156,ISO 3166-2:CN,Asia,Eastern Asia,142,30,1550000,Asia
632,GVB Biopharma,Crops,Biotech,United States,,12.56,United States,US,USA,840,ISO 3166-2:US,Americas,Northern America,19,21,12560000,North America
633,Haber Technologies,Crops,Monitoring & Management,United States,,5.51,United States,US,USA,840,ISO 3166-2:US,Americas,Northern America,19,21,5510000,North America
634,Hachimantai Smart Farm,Crops,Monitoring & Management,Japan,"Bank of Iwate, Japan Finance Corporation, Iwagin Jigyo Souzou Capital",3.28,Japan,JP,JPN,392,ISO 3166-2:JP,Asia,Eastern Asia,142,30,3280000,Asia
635,Haishangxian,Fishing & Seafood,Distribution & Sales,China,"BDStar Navigation, AIRTAC, BIRD, Shunwei Capital Partners, Guigu Huoju Fund, Leye Holding, Sinoagri E-commerce, Vision Plus Capital, Zall Group, Shell",42.13,China,CN,CHN,156,ISO 3166-2:CN,Asia,Eastern Asia,142,30,42130000,Asia
636,Halter,"Livestock, Poultry, & Meats",Monitoring & Management,New Zealand,"Peter Beck, Promus Ventures, First Cut Ventures, Data Collective, Founders Fund, K1W1, Tuhua Ventures, Ubiquity Ventures, Blackbird Ventures",28.6,New Zealand,NZ,NZL,554,ISO 3166-2:NZ,Oceania,Australia and New Zealand,9,53,28600000,Oceania
637,Hamama,Crops,Monitoring & Management,United States,"500 Accelerator, Social Starts, Fourth Wave, Ataraxia VC, 500 Global",5.51,United States,US,USA,840,ISO 3166-2:US,Americas,Northern America,19,21,5510000,North America
638,Hangzhou Dangdaihulian Technology Co. Ltd.,Multi-faceted,Distribution & Sales,China,"Tisiwi Ventures, Liyuan Venture Capital",0.47,China,CN,CHN,156,ISO 3166-2:CN,Asia,Eastern Asia,142,30,470000,Asia
639,HaoFood,"Livestock, Poultry, & Meats",Biotech,China,"Lever VC, Proveg Incubator, Big Idea Ventures",0.15,China,CN,CHN,156,ISO 3166-2:CN,Asia,Eastern Asia,142,30,150000,Asia
640,Happy Quality,Crops,Monitoring & Management,Japan,"Shinkin Capital, HAMACT, Shizuoka Ventures, Sony Innovation Fund",0.96,Japan,JP,JPN,392,ISO 3166-2:JP,Asia,Eastern Asia,142,30,960000,Asia
641,Hardwired,Crops,Monitoring & Management,Romania,Agroland,0.1,Romania,RO,ROU,642,ISO 3166-2:RO,Europe,Eastern Europe,150,151,100000,Europe
642,Harp Renewables,Crops,Biotech,Ireland,"BES Management DAC, Renovare Environmental",5.79,Ireland,IE,IRL,372,ISO 3166-2:IE,Europe,Northern Europe,150,154,5790000,Europe
643,Harpe Bioherbicide Solutions,Crops,Biotech,United States,"AgriTech Capital, Alexandria Venture Investments, iSelect Fund",4.87,United States,US,USA,840,ISO 3166-2:US,Americas,Northern America,19,21,4870000,North America
644,Harvest Automation,Crops,Monitoring & Management,United States,"Life Sciences Partners, MassVentures, MidPoint Food, Founder Collective, Entree Capital, Cultivian Sandbox, Mousse Partners",33.51,United States,US,USA,840,ISO 3166-2:US,Americas,Northern America,19,21,33510000,North America
645,Harvest B,"Livestock, Poultry, & Meats",Biotech,Australia,"Advanced Manufacturing Growth Centre, Alex De Aboitiz, Aura Ventures, Fred Leforestier, Rayn Ong, W23",3.37,Australia,AU,AUS,36,ISO 3166-2:AU,Oceania,Australia and New Zealand,9,53,3370000,Oceania
646,Harvest CROO,Crops,Monitoring & Management,United States,"Sonoco, Paycheck Protection Program, National Science Foundation, iSelect Fund",5.28,United States,US,USA,840,ISO 3166-2:US,Americas,Northern America,19,21,5280000,North America
647,Harvest International,Crops,Monitoring & Management,United States,"Clean Seed Capital, Paycheck Protection Program",0.68,United States,US,USA,840,ISO 3166-2:US,Americas,Northern America,19,21,680000,North America
648,Harvest Returns,Crops,Business Planning & Finance,United States,,3.78,United States,US,USA,840,ISO 3166-2:US,Americas,Northern America,19,21,3780000,North America
649,HarvestPort,Crops,Business Planning & Finance,United States,"Cultivian Sandbox, Taylor Ventures, Fifth Season Ventures, Bowles Farming, Penny Newman, Trinitas Farming",4.5,United States,US,USA,840,ISO 3166-2:US,Americas,Northern America,19,21,4500000,North America
650,Haslea,Fishing & Seafood,Monitoring & Management,United States,,1.5,United States,US,USA,840,ISO 3166-2:US,Americas,Northern America,19,21,1500000,North America
651,Hazel Technologies,Crops,Packing & Supply Chain,United States,"Clean Energy Trust, Rhapsody Venture Partners, Valley Oak Investments, Venture Well, U.S. Department of Agriculture, Climate Impact Capital, S2G Ventures, Serra Ventures, Asahi Kasei Ventures, ImpactAssets, Pangea Ventures, The Grantham Foundation, Larta Institute, Paycheck Protection Program, Jordan Park Group, Pangaea Ventures, Pontifax AgTech, Temasek",88.84,United States,US,USA,840,ISO 3166-2:US,Americas,Northern America,19,21,88840000,North America
652,HeavyConnect,Crops,Business Planning & Finance,United States,"500 Accelerator, Techstars, SAP.iO Foundry Paris",0.25,United States,US,USA,840,ISO 3166-2:US,Americas,Northern America,19,21,250000,North America
653,Hectare Agritech,Multi-faceted,Distribution & Sales,United Kingdom,"Richard Koch, Seedrs",2.79,United Kingdom,GB,GBR,826,ISO 3166-2:GB,Europe,Northern Europe,150,154,2790000,Europe
654,Heliae Development,Crops,Biotech,United States,"London Sumatra Indonesia, Salim Group, Thomas J. Edelman, Paycheck Protection Program",44.08,United States,US,USA,840,ISO 3166-2:US,Americas,Northern America,19,21,44080000,North America
655,Hello Tractor,Crops,Business Planning & Finance,Kenya,"Civic Accelerator, CTA, Founders Factory Africa, MasterCard Start Path, AYuTe Africa Challenge",1.56,Kenya,KE,KEN,404,ISO 3166-2:KE,Africa,Eastern Africa,2,14,1560000,Africa
656,HEMAV,Crops,Monitoring & Management,Spain,"Osborne Clarke, Scranton Enterprises, Horizon 2020, Acciona I'mNovation",3.25,Spain,ES,ESP,724,ISO 3166-2:ES,Europe,Southern Europe,150,39,3250000,Europe
657,HerdDogg,"Livestock, Poultry, & Meats",Monitoring & Management,United States,"Serra Ventures, T-Mobile Accelerator, Innova Memphis, Portland Seed Fund, iSelect Fund, Open Prairie Ventures, Sheldon Group",8.8,United States,US,USA,840,ISO 3166-2:US,Americas,Northern America,19,21,8800000,North America
658,HerdX,"Livestock, Poultry, & Meats",Monitoring & Management,United States,Paycheck Protection Program,13.84,United States,US,USA,840,ISO 3166-2:US,Americas,Northern America,19,21,13840000,North America
659,HERO Protein,Crops,Biotech,China,"Lever VC, Cremer, Plug and Play Accelerator",0.77,China,CN,CHN,156,ISO 3166-2:CN,Asia,Eastern Asia,142,30,770000,Asia
660,Heura Foods,"Livestock, Poultry, & Meats",Biotech,Spain,"Culinary Action Aceleradora, EIT Food, NEOTEC, Unovis Asset Management, Crowdcube, Capital V, Green Monday, Impact Fooding, Lever VC",19.22,Spain,ES,ESP,724,ISO 3166-2:ES,Europe,Southern Europe,150,39,19220000,Europe
661,Heuros,"Livestock, Poultry, & Meats",Biotech,Australia,Proveg Incubator,0.02,Australia,AU,AUS,36,ISO 3166-2:AU,Oceania,Australia and New Zealand,9,53,20000,Oceania
662,Hexafly,Multi-faceted,Business Planning & Finance,Ireland,"RebelBio, SOSV, The Yield Lab, Enterprise Ireland, Halo Business Angel Network",2.62,Ireland,IE,IRL,372,ISO 3166-2:IE,Europe,Northern Europe,150,154,2620000,Europe
663,Hey Maet,"Livestock, Poultry, & Meats",Biotech,China,"Shuangta Food, Tiantu Capital, UpHonest Capital, Junsan Capital, Welight Capital",1.45,China,CN,CHN,156,ISO 3166-2:CN,Asia,Eastern Asia,142,30,1450000,Asia
664,Hi Fidelity Genetics,Crops,Biotech,United States,"Fall Line Capital, Finistere Ventures, Gro Alliance, KdT Ventures, Prairie Crest Capital, S2G Ventures, Tom Farms, Paycheck Protection Program",8.75,United States,US,USA,840,ISO 3166-2:US,Americas,Northern America,19,21,8750000,North America
665,Hiber Global,Multi-faceted,Monitoring & Management,Netherlands,"Hartenlust Group, Netherlands Enterprise Agency, Finch Capital, EIC Accelerator, Eco-Innovation Initiative, European Innovation Council",40.79,Netherlands,NL,NLD,528,ISO 3166-2:NL,Europe,Western Europe,150,155,40790000,Europe
666,Higher Steaks,"Livestock, Poultry, & Meats",Biotech,United Kingdom,Pearse Lyons Cultivator,0.02,United Kingdom,GB,GBR,826,ISO 3166-2:GB,Europe,Northern Europe,150,154,20000,Europe
667,HitchPin,Multi-faceted,Business Planning & Finance,United States,,2.35,United States,US,USA,840,ISO 3166-2:US,Americas,Northern America,19,21,2350000,North America
668,Hive UAV,Crops,Monitoring & Management,Australia,Slingshot,0.02,Australia,AU,AUS,36,ISO 3166-2:AU,Oceania,Australia and New Zealand,9,53,20000,Oceania
669,Holganix,Crops,Biotech,United States,"Delaware Crossing Investment Group, BlueTree Allied Angels, JumpStart NJ Angel Network, Originate Ventures, The Yield Lab, Missouri Technology Corporation, iSelect Fund, F3 Tech Accelerator",5.2,United States,US,USA,840,ISO 3166-2:US,Americas,Northern America,19,21,5200000,North America
670,HoneyComb Corp.,Crops,Monitoring & Management,United States,"Prosper Portland, VertueLab, Portland Seed Fund",0.46,United States,US,USA,840,ISO 3166-2:US,Americas,Northern America,19,21,460000,North America
671,Hoober Feeds,"Livestock, Poultry, & Meats",Biotech,United States,,1.2,United States,US,USA,840,ISO 3166-2:US,Americas,Northern America,19,21,1200000,North America
672,Hooked Foods,Fishing & Seafood,Biotech,Sweden,"Food Angels, Kale United, Katapult Ocean, Plus Capital, Proveg Incubator, Wave Ventures, Brightly Ventures, Danny Saucedo, Oyster Bay",5.27,Sweden,SE,SWE,752,ISO 3166-2:SE,Europe,Northern Europe,150,154,5270000,Europe
673,Hooray Foods,Crops,Biotech,United States,"Plug and Play Accelerator, GlassWall Syndicate, Stray Dog Capital, Evolution VC Partners, Gaingels, Sand Hill Angels, David Hoffman, Lyra Growth Partners",5.22,United States,US,USA,840,ISO 3166-2:US,Americas,Northern America,19,21,5220000,North America
674,Hortau,Crops,Monitoring & Management,United States,"Rio Investment Partners, Telesystem, Business Capital, Advantage Capital, BDC Venture Capital, Desjardins, Sustainable Development Technology Canada, Capital regional et cooperatif Desjardins, Export Development Canada, FondAction CSN, Fonds de Solidarite FTQ, Lewis & Clark AgriFood",114.3,United States,US,USA,840,ISO 3166-2:US,Americas,Northern America,19,21,114300000,North America
675,Hortiya,Crops,Monitoring & Management,Germany,German Federal Environmental Foundation,0.15,Germany,DE,DEU,276,ISO 3166-2:DE,Europe,Western Europe,150,155,150000,Europe
676,Horus Aeronaves,Crops,Monitoring & Management,Brazil,"SP Ventures, EqSeed, Cedro Capital",1.81,Brazil,BR,BRA,76,ISO 3166-2:BR,Americas,South America,19,5,1810000,South America
677,Hoxton Farms,"Livestock, Poultry, & Meats",Biotech,United Kingdom,"Backed VC, CPT Capital, Founders Fund, Presight Capital, Sustainable Food Ventures",3.72,United Kingdom,GB,GBR,826,ISO 3166-2:GB,Europe,Northern Europe,150,154,3720000,Europe
678,Hudson River Biotechnology,Crops,Biotech,Netherlands,"Bridford Investments, European Commission",5.9,Netherlands,NL,NLD,528,ISO 3166-2:NL,Europe,Western Europe,150,155,5900000,Europe
679,Hummingbird Technologies,Crops,Monitoring & Management,United Kingdom,"European Space Agency, James Dyson, Newable, Velcourt, Saudi Agricultural & Livestock Investment Company, BASF Venture Capital, Downing Ventures, TELUS Ventures",12.99,United Kingdom,GB,GBR,826,ISO 3166-2:GB,Europe,Northern Europe,150,154,12990000,Europe
680,Hungry Harvest,Crops,Distribution & Sales,United States,"Conscious Venture Lab, Ungraded Produce, Creadev, Delphine Descamps, Desert Bloom, Hans Taparia, Danone Manifesto Ventures",13.97,United States,US,USA,840,ISO 3166-2:US,Americas,Northern America,19,21,13970000,North America
681,Hungry Planet,"Livestock, Poultry, & Meats",Biotech,United States,"Paycheck Protection Program, Post Holdings, TRIREC",30.87,United States,US,USA,840,ISO 3166-2:US,Americas,Northern America,19,21,30870000,North America
682,Husarion,Crops,Biotech,United States,"KPD Investment, Kickstarter",0.11,United States,US,USA,840,ISO 3166-2:US,Americas,Northern America,19,21,110000,North America
683,HUVRData,Crops,Monitoring & Management,United States,"Central Texas Angel Network, Houston Angel Network, Paycheck Protection Program, Cottonwood Venture Partners, Wild Basin Investments",7.25,United States,US,USA,840,ISO 3166-2:US,Americas,Northern America,19,21,7250000,North America
684,HydroBio,Crops,Monitoring & Management,United States,"Monsanto Growth Ventures, Climate FieldView",0.06,United States,US,USA,840,ISO 3166-2:US,Americas,Northern America,19,21,60000,North America
685,Hydrofarm,Crops,Monitoring & Management,United States,"Broadband Capital Management, Hawthorn Equity Partners, Serruya Private Equity, Unrivaled Brands, Paycheck Protection Program",89.56,United States,US,USA,840,ISO 3166-2:US,Americas,Northern America,19,21,89560000,North America
686,HydroPoint Data Systems,Crops,Monitoring & Management,United States,"Chrysalix Venture Capital, Firelake Capital, J.F. Shea, Monitor Ventures, RockPort Capital Partners, The Toro Company, Raisin Capital Management, Sustainable Development Investments, Emerald Technology Ventures, Wincubator, Paycheck Protection Program, Shea Ventures, BOLD Capital Partners, Greenhouse Capital Partners",72.13,United States,US,USA,840,ISO 3166-2:US,Americas,Northern America,19,21,72130000,North America
687,ICAN Technology,Crops,Monitoring & Management,China,"Hillhouse Capital Management, Linear Venture",1.46,China,CN,CHN,156,ISO 3166-2:CN,Asia,Eastern Asia,142,30,1460000,Asia
688,IDGeo,Crops,Monitoring & Management,Brazil,"Sao Paulo Research Foundation, Poli Angels",0.54,Brazil,BR,BRA,76,ISO 3166-2:BR,Americas,South America,19,5,540000,South America
689,iFarm,Crops,Monitoring & Management,Russian Federation,"Gagarin Capital Partners, Sergey Ambrosov, Sergey Ryzhikov, Boris Kim, IMI.VC, ImpulseVC, Matrix Capital",5,Russian Federation,RU,RUS,643,ISO 3166-2:RU,Europe,Eastern Europe,150,151,5000000,Europe
690,iFarmer,Multi-faceted,Business Planning & Finance,Bangladesh,"Accelerating Asia, Falcon Network",0.6,Bangladesh,BD,BGD,50,ISO 3166-2:BD,Asia,Southern Asia,142,34,600000,Asia
691,iFood Decision Sciences,Crops,Packing & Supply Chain,United States,Warburg Pincus,14,United States,US,USA,840,ISO 3166-2:US,Americas,Northern America,19,21,14000000,North America
692,iFoodDS,Crops,Distribution & Sales,United States,Insight Partners,15,United States,US,USA,840,ISO 3166-2:US,Americas,Northern America,19,21,15000000,North America
693,Illumitex,Multi-faceted,Monitoring & Management,United States,"Aweida Venture Partners, Mercury Fund, New Enterprise Associates, Applied Ventures, Apex Venture Partners, Mousse Partners, Syngenta Ventures, Union Grove Venture Partners, WP Global Partners",77.78,United States,US,USA,840,ISO 3166-2:US,Americas,Northern America,19,21,77780000,North America
694,Imagindairy,"Livestock, Poultry, & Meats",Biotech,Israel,"CPT Capital, Entree Capital, Israel Innovation Authority, The Kitchen, Unovis Asset Management, Collaborative Fund, Emerald Technology Ventures, Green Circle Foodtech Ventures, MoreVC, New Climate Ventures, Pierre Besnainou, S2G Ventures, Strauss Group",14.5,Israel,IL,ISR,376,ISO 3166-2:IL,Asia,Western Asia,142,145,14500000,Asia
695,Imago AI,Crops,Biotech,India,Techstars,0.12,India,IN,IND,356,ISO 3166-2:IN,Asia,Southern Asia,142,34,120000,Asia
696,Impact NRS,Crops,Biotech,United States,,32.8,United States,US,USA,840,ISO 3166-2:US,Americas,Northern America,19,21,32800000,North America
697,Impact Terra,Crops,Monitoring & Management,Myanmar,Netherlands Space Office Geodata for Agriculture and Water Facility,3,Myanmar,MM,MMR,104,ISO 3166-2:MM,Asia,South-Eastern Asia,142,35,3000000,Asia
698,Impetus Agriculture,Crops,Biotech,United States,"Burrill & Company, Prolog Ventures, Spruce Capital Partners, St. Louis Arch Angels",1.29,United States,US,USA,840,ISO 3166-2:US,Americas,Northern America,19,21,1290000,North America
699,Impossible Foods,"Livestock, Poultry, & Meats",Biotech,United States,"Bill Gates, Google Ventures, Horizons Ventures, Khosla Ventures, UBS, Viking Global Investors, Trinity Capital Investment, Horizon Ventures, Open Philanthropy Project, Temasek, Sailing Capital, Ahmir Thompson, Alexis Ohanian, Anton Zaslavski, G Squared, Jaden Smith, Jay Brown, Kal Penn, Katheryn Hudson, Katy Perry, Kirk Cousins, Paul George, Phil Rosenthal, Ruby Rose, Serena Ventures, Shawn Carter, Trevor Noah, William Adams, Lonnie Corant Jaman Shuka Rashid Lynn, Mindy Kaling, Mirae Asset Financial Group, Peter Jackson, Serena Williams, Coatue Management, Mirae Asset Global Investments, XN Capital, Manhattan Venture Partners, Conti Ventures",2006.16,United States,US,USA,840,ISO 3166-2:US,Americas,Northern America,19,21,2006160000,North America
700,inaho,Crops,Monitoring & Management,Japan,"Emergence Planning, ITOCHU Technology Ventures, dof, Future Food Fund",1.6,Japan,JP,JPN,392,ISO 3166-2:JP,Asia,Eastern Asia,142,30,1600000,Asia
701,Inalve,"Livestock, Poultry, & Meats",Biotech,France,"Forum Ventures, Angels for Greentech, Angels' Bay Invest, Arts & Metiers Business Angels, INSEAD Alumni Business Angels, R2V, Region Sud Investissement, Turenne Capital Partenaires",3.4,France,FR,FRA,250,ISO 3166-2:FR,Europe,Western Europe,150,155,3400000,Europe
702,Inari,Crops,Biotech,United States,"Acre Venture Partners, Alexandria Venture Investments, Flagship Pioneering, EDBI, Investment Corporation of Dubai, K2 HealthVentures, G Squared, Pavilion Capital, Pictet Group, Rivas Capital",397,United States,US,USA,840,ISO 3166-2:US,Americas,Northern America,19,21,397000000,North America
703,InCeres,Crops,Monitoring & Management,Brazil,SP Ventures,0.76,Brazil,BR,BRA,76,ISO 3166-2:BR,Americas,South America,19,5,760000,South America
704,INdependent Data Management,Crops,Monitoring & Management,United States,"Open Prairie Ventures, Paycheck Protection Program",5.83,United States,US,USA,840,ISO 3166-2:US,Americas,Northern America,19,21,5830000,North America
705,Indigo Ag,Crops,Biotech,United States,"Flagship Pioneering, Altitude Life Science Ventures, Alaska Permanent Fund, Activant Capital, Baillie Gifford & Co., Investment Corporation of Dubai, G Squared, FedEx, Pacific Western Bank, Riverstone Holdings",1176.5,United States,US,USA,840,ISO 3166-2:US,Americas,Northern America,19,21,1176500000,North America
706,indorz,Crops,Monitoring & Management,Israel,,1.4,Israel,IL,ISR,376,ISO 3166-2:IL,Asia,Western Asia,142,145,1400000,Asia
707,InFarm,Crops,Monitoring & Management,Germany,"Indiegogo, EuropeanPioneers, Horizon 2020, Atlantic Food Labs, Cherry Ventures, Demand Analytics, IDEO, LocalGlobe, Quadia, Balderton Capital, Mons Investments, TriplePoint Capital, Astanor Ventures, Atomico, East Japan Railway Company, Bonnier Ventures, Franz Haniel & Cie, Hanaco Venture Capital, Latitude Ventures, Lightrock, Partners in Equity, Qatar Investment Authority",601.59,Germany,DE,DEU,276,ISO 3166-2:DE,Europe,Western Europe,150,155,601590000,Europe
708,Infinite Harvest,Crops,Monitoring & Management,United States,,2.16,United States,US,USA,840,ISO 3166-2:US,Americas,Northern America,19,21,2160000,North America
709,Inflection Point Technologies,Crops,Monitoring & Management,United States,Iowa Economic Development Authority,0.03,United States,US,USA,840,ISO 3166-2:US,Americas,Northern America,19,21,30000,North America
710,InfyU Labs,Crops,Packing & Supply Chain,India,"Boeing India BUILD, Indian Angel Network",0.25,India,IN,IND,356,ISO 3166-2:IN,Asia,Southern Asia,142,34,250000,Asia
711,INNO-3B,Crops,Monitoring & Management,Canada,"Ecofuel Accelerator, Desjardins Capital, Fonds de Solidarite FTQ, Investissement Quebec, Premier Tech, Quebec Ministere de l'Economie, de l'Innovation et des Exportations",4.56,Canada,CA,CAN,124,ISO 3166-2:CA,Americas,Northern America,19,21,4560000,North America
712,InnovaFeed,Multi-faceted,Biotech,France,"Alter Equity, Finovam, Nord Creation, Nord France Amorcage, Creadev, Horizon 2020, Temasek",182.4,France,FR,FRA,250,ISO 3166-2:FR,Europe,Western Europe,150,155,182400000,Europe
713,Inseact,Fishing & Seafood,Biotech,Singapore,"ADB Ventures, Claudia Zeisberger, INSEAD Angels, Idgar Kippersluis, Loyal VC",1.3,Singapore,SG,SGP,702,ISO 3166-2:SG,Asia,South-Eastern Asia,142,35,1300000,Asia
714,Insight Robotics,Crops,Monitoring & Management,Hong Kong,"Beyond Ventures, Brizan Investments, Linear Capital Partners",9,Hong Kong,HK,HKG,344,ISO 3166-2:HK,Asia,Eastern Asia,142,30,9000000,Asia
715,InspiraFarms,Multi-faceted,Packing & Supply Chain,United Kingdom,"DOEN Foundation, Energy Access Ventures, Factor(e) Ventures, Montpelier Foundation, PYMWYMIC, KawiSafi Ventures",8.18,United Kingdom,GB,GBR,826,ISO 3166-2:GB,Europe,Northern Europe,150,154,8180000,Europe
716,InstaAgro,Multi-faceted,Business Planning & Finance,Brazil,Daniel Bachner,0.6,Brazil,BR,BRA,76,ISO 3166-2:BR,Americas,South America,19,5,600000,South America
717,Insurion,Multi-faceted,Business Planning & Finance,Russian Federation,"Fintech Lab, Sberbank and 500 Startups Accelerator, Fund4SE",0.4,Russian Federation,RU,RUS,643,ISO 3166-2:RU,Europe,Eastern Europe,150,151,400000,Europe
718,INSYLO,"Livestock, Poultry, & Meats",Monitoring & Management,Spain,"IMPACT Accelerator, European Food Nexus Startup Challenge, Agro Innovation Lab, Japfa Feeds the Future",0.17,Spain,ES,ESP,724,ISO 3166-2:ES,Europe,Southern Europe,150,39,170000,Europe
719,Integrated Agriculture Systems,Crops,Monitoring & Management,United States,,1.5,United States,US,USA,840,ISO 3166-2:US,Americas,Northern America,19,21,1500000,North America
720,IntegriCulture,"Livestock, Poultry, & Meats",Biotech,Japan,"A-FIVE, Beyond Next Ventures, Hiroaki Kitano, MTG, Real Tech Fund, AgFunder, Hiroshima Venture Capital, NH Foods, Naruhisa Nakagawa, VU Venture Partners, kemuri ventures, Future Food Fund, Iyogin Capital Company, Plan Do See, Resona Capital, SuMi Trust Innovation Fund, Yamaguchi Capital",17.19,Japan,JP,JPN,392,ISO 3166-2:JP,Asia,Eastern Asia,142,30,17190000,Asia
721,Inteligistics,Multi-faceted,Packing & Supply Chain,United States,"U.S. Department of Defense, U.S. Navy, Innovation Works, THRIVE Accelerator",1.69,United States,US,USA,840,ISO 3166-2:US,Americas,Northern America,19,21,1690000,North America
722,IntelinAir,Crops,Monitoring & Management,United States,"HBS Alumni Angels Association, HIVE Ventures, Holdsworth & Company, Hyde Park Venture Partners, Western Technology Investment, Granatus Ventures, Regulator Group, SDMC Ag, Scientia Ventures, Takiff, Tim Hassinger",23.5,United States,US,USA,840,ISO 3166-2:US,Americas,Northern America,19,21,23500000,North America
723,Intelliculture,Crops,Business Planning & Finance,Canada,"Accelerator Centre, 519 Growth Fund, Emmertech",1.37,Canada,CA,CAN,124,ISO 3166-2:CA,Americas,Northern America,19,21,1370000,North America
724,Intelligent Growth Solutions,Crops,Monitoring & Management,United Kingdom,"AgFunder, S2G Ventures, Scottish Investment Bank, Ospraie Management, Cleveland Avenue, Cofra Holding, DC Thomson Ventures, Ospraie Ag Science, Scottish Enterprise",65.67,United Kingdom,GB,GBR,826,ISO 3166-2:GB,Europe,Northern Europe,150,154,65670000,Europe
725,Intello Labs,Crops,Monitoring & Management,India,"World Food India, Indigram Labs, MassChallenge, Plug and Play Accelerator, Nexus Venture Partners, Omnivore Partners, Target Accelerator Program, GROW, Google for Startups Accelerator, a-IDEA, GO, Saama Capital, THRIVE Accelerator, Avaana Capital",12.9,India,IN,IND,356,ISO 3166-2:IN,Asia,Southern Asia,142,34,12900000,Asia
726,Intergado,"Livestock, Poultry, & Meats",Monitoring & Management,Brazil,"Criatec Fund, KPTL",2.56,Brazil,BR,BRA,76,ISO 3166-2:BR,Americas,South America,19,5,2560000,South America
727,International Farming,Multi-faceted,Business Planning & Finance,United States,,1.4,United States,US,USA,840,ISO 3166-2:US,Americas,Northern America,19,21,1400000,North America
728,Intravision Greens Niagra,Crops,Monitoring & Management,Canada,Mosaic Capital Partners,1.6,Canada,CA,CAN,124,ISO 3166-2:CA,Americas,Northern America,19,21,1600000,North America
729,IoAgri,Crops,Monitoring & Management,Italy,"Auriga, CDP Venture Capital SGR",0.52,Italy,IT,ITA,380,ISO 3166-2:IT,Europe,Southern Europe,150,39,520000,Europe
