309,Climate FieldView,Multi-faceted,Business Planning & Finance,United States,"Allen & Company, Atomico, First Round Capital, Index Ventures, New Enterprise Associates, Code Advisors, Google Ventures, Khosla Ventures, Felicis, Founders Fund, Glynn Capital Management, Western Technology Investment, Monsanto",108.8,United States,US,USA,840,ISO 3166-2:US,Americas,Northern America,19,21,108800000,North America
310,ClimateMinder,Crops,Monitoring & Management,United States,Partners 1993,0.75,United States,US,USA,840,ISO 3166-2:US,Americas,Northern America,19,21,750000,North America
311,Climax Foods,"Livestock, Poultry, & Meats",Biotech,United States,"S2G Ventures, Manta Ray, Artis Ventures, At One Ventures, Canaccord Genuity Group, Embark Healthcare, Global Founders Capital, Index Ventures, Luminous VC, Prelude Ventures, Valor Equity Partners",7.5,United States,US,USA,840,ISO 3166-2:US,Americas,Northern America,19,21,7500000,North America
312,Cloud Agronomics,Crops,Monitoring & Management,United States,"Augment Ventures, SineWave Ventures",6,United States,US,USA,840,ISO 3166-2:US,Americas,Northern America,19,21,6000000,North America
313,Co-Fishery,Fishing & Seafood,Distribution & Sales,South Korea,"Krypton, J-CCEI, Big Basin Capital, Seoul Techno Holdings",0.81,South Korea,KR,KOR,410,ISO 3166-2:KR,Asia,Eastern Asia,142,30,810000,Asia
314,Cocogreen,Crops,Monitoring & Management,United Kingdom,"Northern Powerhouse Investment Fund, Caple, Close Brothers Group, Whitehall Finance, Circularity Capital",6.83,United Kingdom,GB,GBR,826,ISO 3166-2:GB,Europe,Northern Europe,150,154,6830000,Europe
315,Cogastro,Crops,Monitoring & Management,Lithuania,"Koinvesticinis fondas, Coinvest Capital, Lithuanian Business Angel Network",0.67,Lithuania,LT,LTU,440,ISO 3166-2:LT,Europe,Northern Europe,150,154,670000,Europe
316,Combplex,Crops,Monitoring & Management,United States,"Launchpad Lift, New York State Energy Research and Development Authority (NYSERDA)",0.5,United States,US,USA,840,ISO 3166-2:US,Americas,Northern America,19,21,500000,North America
317,Comet Biorefining,Crops,Biotech,Canada,"Sofinnova Partners, Sustainable Development Technology Canada, Bioindustrial Innovation Canada, PM Equity Partner",8.56,Canada,CA,CAN,124,ISO 3166-2:CA,Americas,Northern America,19,21,8560000,North America
318,Community Farmers Markets,Crops,Business Planning & Finance,United States,Civic Accelerator,0.01,United States,US,USA,840,ISO 3166-2:US,Americas,Northern America,19,21,10000,North America
319,Complete Farmer,Multi-faceted,Distribution & Sales,Ghana,"DEMO Africa Casablanca, World Economic Forum Mentoring Program, Village Capital, Westerwelle Young Founders Program, Kepple Africa Ventures, Ingressive Capital, Norrsken Impact Accelerator",0.1,Ghana,GH,GHA,288,ISO 3166-2:GH,Africa,Africa,2,11,100000,Africa
320,Concentric Ag,Crops,Biotech,United States,"Cycle Capital, Desjardins, Closed Loop Capital, Red Metal Capital, TPG Alternative & Renewable Technologies, Sustainable Development Technology Canada, Cairn Investments, Pontifax AgTech",63.22,United States,US,USA,840,ISO 3166-2:US,Americas,Northern America,19,21,63220000,North America
321,Connecterra,"Livestock, Poultry, & Meats",Monitoring & Management,Netherlands,"Breed Reply, DeNA, Elias Tabet, MENA Venture Investments, European Commission, 7Percent, Acequia Capital, AgFunder, Henrik Bles, Sistema Venture Capital, ADM Capital, Kersia, PYMWYMIC",15.36,Netherlands,NL,NLD,528,ISO 3166-2:NL,Europe,Western Europe,150,155,15360000,Europe
322,Connecting Food,Crops,Packing & Supply Chain,France,"IBM Blockchain Accelerator, EIT Food, IDIA Capital Investissement, Leadblock Partners, SAP.iO Foundry Paris",3.5,France,FR,FRA,250,ISO 3166-2:FR,Europe,Western Europe,150,155,3500000,Europe
323,Conservis,Multi-faceted,Business Planning & Finance,United States,"Heartland Advisors, Middleland Capital, Cultivian Sandbox, Pontifax AgTech, Paycheck Protection Program",50.91,United States,US,USA,840,ISO 3166-2:US,Americas,Northern America,19,21,50910000,North America
324,Contain,Crops,Monitoring & Management,United States,Techstars,0.12,United States,US,USA,840,ISO 3166-2:US,Americas,Northern America,19,21,120000,North America
325,Continuum AG,Crops,Monitoring & Management,United States,"AgLaunch, Ag Startup Engine, Ag Ventures Alliance, Clean Energy Trust",0.66,United States,US,USA,840,ISO 3166-2:US,Americas,Northern America,19,21,660000,North America
326,Cooks Venture,"Livestock, Poultry, & Meats",Distribution & Sales,United States,"AMERRA Capital Management, Golden West Food Group, Cultivian Sandbox, John Roulac, Larry Schwartz, SJF Ventures, PIUS",142.32,United States,US,USA,840,ISO 3166-2:US,Americas,Northern America,19,21,142320000,North America
327,Corigin Solutions,Multi-faceted,Monitoring & Management,United States,Focus Ventures,4.07,United States,US,USA,840,ISO 3166-2:US,Americas,Northern America,19,21,4070000,North America
328,CosmicGreen,Crops,Biotech,South Korea,"SpringCamp, TIPS Program, Donghoon Investment",0.87,South Korea,KR,KOR,410,ISO 3166-2:KR,Asia,Eastern Asia,142,30,870000,Asia
329,Country Delight,"Livestock, Poultry, & Meats",Distribution & Sales,India,"MAN Impact Accelerator, Dvara Trust, Matrix Partners India, Orios Venture Partners, IIFL AMC, SAIF Partners",35,India,IN,IND,356,ISO 3166-2:IN,Asia,Southern Asia,142,34,35000000,Asia
330,Cowealthy,"Livestock, Poultry, & Meats",Monitoring & Management,Turkey,"Bilisim Vadisi, Valley Growth Ventures, Bener Karadeniz, Ismail Bican, Melih Erturk, Mevlut Altunterim, Volkan Uslu, Yucel Saykal",0.4,Turkey,TR,TUR,792,ISO 3166-2:TR,Asia,Western Asia,142,145,400000,Asia
331,Cowlar,"Livestock, Poultry, & Meats",Monitoring & Management,United States,"1776 Global Challenge Cup, Pakistan StartUp Cup, Y Combinator, Ashton Kutcher, AgLaunch",0.24,United States,US,USA,840,ISO 3166-2:US,Americas,Northern America,19,21,240000,North America
332,Cricket One,Crops,Biotech,Vietnam,"Startupbootcamp FoodTech, 500 Global, Masik Enterprise, Corecam Family Office",0.02,Vietnam,,,,,Asia,Southern Asia,,,20000,Asia
333,Crocus Labs,Crops,Monitoring & Management,Germany,High-Tech Grunderfonds,0.36,Germany,DE,DEU,276,ISO 3166-2:DE,Europe,Western Europe,150,155,360000,Europe
334,Crofarm,Crops,Distribution & Sales,India,"Ashish Gupta, Himanshu Aggarwal, Mukul Singhal, Rohit Jain, Sunil Goyal, Factor(e) Ventures, Jitendra Gupta, LetsVenture, Rajan Anandan, Ashish Chand, Pravega Ventures, Ramit Sethi, Vinay Mittal, Smile Group, Inflection Point Ventures, InnoVen Capital, Omidyar Network India, Susquehanna International Group, Omidyar Network, SAI Global, WestBridge Capital",46.98,India,IN,IND,356,ISO 3166-2:IN,Asia,Southern Asia,142,34,46980000,Asia
335,Cromai,Crops,Monitoring & Management,Brazil,"Agro Exponencial, Stoller Group",0.94,Brazil,BR,BRA,76,ISO 3166-2:BR,Americas,South America,19,5,940000,South America
336,Crop Enhancement,Crops,Biotech,United States,"Phoenix Venture Partners, 1955 Capital, Bandgap Ventures, Spruce Capital Partners, Xeraya Capital, Cavallo Ventures, Plug and Play Accelerator, Alexandria Venture Investments, Davinia Investments",25,United States,US,USA,840,ISO 3166-2:US,Americas,Northern America,19,21,25000000,North America
337,Crop One,Crops,Monitoring & Management,United States,Band of Angels,43.41,United States,US,USA,840,ISO 3166-2:US,Americas,Northern America,19,21,43410000,North America
338,Crop Ventures,Multi-faceted,Monitoring & Management,United States,,1,United States,US,USA,840,ISO 3166-2:US,Americas,Northern America,19,21,1000000,North America
339,CropDesign,Crops,Biotech,Belgium,"Atlas Venture, Gimv, Sofinnova Ventures, Burrill & Company, Gilde Healthcare Partners, ING, KBC Group, Technolife-Rothschild, BioDiscovery, KBC Private Equity, Omega Pharma, BASF",59.8,Belgium,BE,BEL,56,ISO 3166-2:BE,Europe,Western Europe,150,155,59800000,Europe
340,Cropdesk,Multi-faceted,Business Planning & Finance,United Kingdom,Innovate UK,0.32,United Kingdom,GB,GBR,826,ISO 3166-2:GB,Europe,Northern Europe,150,154,320000,Europe
341,Cropin Technology Solutions,Crops,Packing & Supply Chain,India,"Ankur Capital, Sophia ApS, Wharton India Economic Forum, BEENEXT, Invested Development, Bill & Melinda Gates Foundation, Chiratae Ventures, ABC World Asia, CDC Group, Pratithi Investment Trust",30.05,India,IN,IND,356,ISO 3166-2:IN,Asia,Southern Asia,142,34,30050000,Asia
342,CropLogic,Crops,Monitoring & Management,New Zealand,"Callaghan Innovation, Equitise",0.96,New Zealand,NZ,NZL,554,ISO 3166-2:NZ,Oceania,Australia and New Zealand,9,53,960000,Oceania
343,CropMetrics,Crops,Monitoring & Management,United States,"Invest Nebraska, Nelnet, CropX",2.75,United States,US,USA,840,ISO 3166-2:US,Americas,Northern America,19,21,2750000,North America
344,CropSafe,Crops,Monitoring & Management,United Kingdom,Ignite NI Accelerator,0.02,United Kingdom,GB,GBR,826,ISO 3166-2:GB,Europe,Northern Europe,150,154,20000,Europe
345,Croptide,Crops,Monitoring & Management,New Zealand,"Icehouse Ventures, K1W1, Masfen Group",0.67,New Zealand,NZ,NZL,554,ISO 3166-2:NZ,Oceania,Australia and New Zealand,9,53,670000,Oceania
346,Croptimize,Crops,Monitoring & Management,United States,CanopyBoulder,0.03,United States,US,USA,840,ISO 3166-2:US,Americas,Northern America,19,21,30000,North America
347,CropTrak,Crops,Business Planning & Finance,United States,,21.34,United States,US,USA,840,ISO 3166-2:US,Americas,Northern America,19,21,21340000,North America
348,CropX,Crops,Monitoring & Management,Israel,"Finistere Ventures, GreenSoil Investments, Innovation Endeavors, OurCrowd, Lab IX, Robert Bosch Venture Capital, ICL Group, Ireland Strategic Investment Fund, ARMADA Capital, Germin8 Ventures, Sumitomo Corporation, Tal Capital, Extreme Tech Challenge, NEC, HELM",20.5,Israel,IL,ISR,376,ISO 3166-2:IL,Asia,Western Asia,142,145,20500000,Asia
349,CropZilla Software,Crops,Monitoring & Management,United States,,1.4,United States,US,USA,840,ISO 3166-2:US,Americas,Northern America,19,21,1400000,North America
350,Crowde,Crops,Business Planning & Finance,Indonesia,"DBS-NUS Social Venture Challenge Asia, UMG Indonesia, CREVISSE Partners, STRIVE, Mandiri Capital, Monk's Hill Ventures",9.1,Indonesia,ID,IDN,360,ISO 3166-2:ID,Asia,South-Eastern Asia,142,35,9100000,Asia
351,CUBIQ FOODS,"Livestock, Poultry, & Meats",Biotech,Spain,"Moira Capital Partners, Blue Horizon",19.07,Spain,ES,ESP,724,ISO 3166-2:ES,Europe,Southern Europe,150,39,19070000,Europe
352,Cultiva,Crops,Packing & Supply Chain,United States,"Nevada New Markets Tax Credit Program, Advantage Capital",8.79,United States,US,USA,840,ISO 3166-2:US,Americas,Northern America,19,21,8790000,North America
353,Cultivated Biosciences,"Livestock, Poultry, & Meats",Biotech,Netherlands,Proveg Incubator,0.02,Netherlands,NL,NLD,528,ISO 3166-2:NL,Europe,Western Europe,150,155,20000,Europe
354,Cultivated Eco Systems,Crops,Biotech,Canada,Ignite Labs,0.04,Canada,CA,CAN,124,ISO 3166-2:CA,Americas,Northern America,19,21,40000,North America
355,Cultured Decadence,Fishing & Seafood,Biotech,United States,"gener8tor, Bascom Ventures, Bluestein Ventures, Dao Foods International, GlassWall Syndicate, Revolution Rise Of The Rest Seed Fund, Social Starts, Wisconsin Economic Development Corp., Good Startup, UPSIDE Foods",1.7,United States,US,USA,840,ISO 3166-2:US,Americas,Northern America,19,21,1700000,North America
356,Cultyvate,Crops,Monitoring & Management,India,"YES SCALE, Villgro",0.04,India,IN,IND,356,ISO 3166-2:IN,Asia,Southern Asia,142,34,40000,Asia
357,Cyberhawk Innovations,Crops,Monitoring & Management,United Kingdom,"Scottish Equity Partners, Scottish Investment Bank, Scottish & Southern Energy, Clydesdale Bank, Magnesium Capital",4.73,United Kingdom,GB,GBR,826,ISO 3166-2:GB,Europe,Northern Europe,150,154,4730000,Europe
358,Dafengshou,Crops,Distribution & Sales,China,"China Growth Capital, Matrix Partners China, Orchid Asia Group Management, Shangde Heli, Yongchuang Capital",29,China,CN,CHN,156,ISO 3166-2:CN,Asia,Eastern Asia,142,30,29000000,Asia
359,DaNAgreen,"Livestock, Poultry, & Meats",Biotech,South Korea,"TIPS Program, Sunbo Angel Partners, Expara, Industrial Bank of Korea, JW Asset, Lighthouse Combined Investment, Hi Investment Partners, Lotte Ventures, Pathfinder H, Penture Invest, Timewise Investment",8.85,South Korea,KR,KOR,410,ISO 3166-2:KR,Asia,Eastern Asia,142,30,8850000,Asia
360,Daring Foods,"Livestock, Poultry, & Meats",Biotech,United States,"Rastelli Foods Group, Brian Swette, Good Friends, Maveron, Michael Smith, Palm Tree Crew Investments, Stray Dog Capital, Aubrey Drake Graham, D1 Capital Partners, Cam Newton, Chase Coleman, Founders Fund, Naomi Osaka, Steve Aoki",124.44,United States,US,USA,840,ISO 3166-2:US,Americas,Northern America,19,21,124440000,North America
361,DataLand,Multi-faceted,Business Planning & Finance,Brazil,"GHT4, Potato Valley Ventures",0.96,Brazil,BR,BRA,76,ISO 3166-2:BR,Americas,South America,19,5,960000,South America
362,Decisive Farming,Crops,Monitoring & Management,Canada,"Accelerate Fund, Export Development Canada, McRock Capital, Accelerator Fund, TELUS",8.48,Canada,CA,CAN,124,ISO 3166-2:CA,Americas,Northern America,19,21,8480000,North America
363,DeepGreen,Crops,Monitoring & Management,United States,CanopyBoulder,0.35,United States,US,USA,840,ISO 3166-2:US,Americas,Northern America,19,21,350000,North America
364,Degas,Crops,Business Planning & Finance,Japan,"Heart Driven Fund, Primal Capital",2.29,Japan,JP,JPN,392,ISO 3166-2:JP,Asia,Eastern Asia,142,30,2290000,Asia
365,DeHaat,Crops,Distribution & Sales,India,"AgFunder, Omnivore Partners, Pankaj Chaddah, Trifecta Capital Advisors, FMO, Sequoia Capital India, Prosus Ventures, RTP Global, Lightrock, Sofina, Temasek",164.14,India,IN,IND,356,ISO 3166-2:IN,Asia,Southern Asia,142,34,164140000,Asia
366,Delair-Tech,Multi-faceted,Monitoring & Management,France,"Andromede, Bpifrance, Intel Capital",14.5,France,FR,FRA,250,ISO 3166-2:FR,Europe,Western Europe,150,155,14500000,Europe
367,Deliciou,"Livestock, Poultry, & Meats",Biotech,Australia,"Startmate, Stray Dog Capital",0.08,Australia,AU,AUS,36,ISO 3166-2:AU,Oceania,Australia and New Zealand,9,53,80000,Oceania
368,Deliveristo,Multi-faceted,Distribution & Sales,Italy,"Doorway, Gellify, IAG Capital Partners, Metrica Ventures, Seven Fund, United Ventures",5.47,Italy,IT,ITA,380,ISO 3166-2:IT,Europe,Southern Europe,150,39,5470000,Europe
369,DELOS,"Livestock, Poultry, & Meats",Business Planning & Finance,Indonesia,"Arise, Hendra Kwik, Irvan Kolonas, MDI Ventures, Number Capital, iSeed SEA, Alpha JWC Ventures, Alto Partners, Centauri Fund, James Prananto, Mahanusa Capital",8,Indonesia,ID,IDN,360,ISO 3166-2:ID,Asia,South-Eastern Asia,142,35,8000000,Asia
370,Demand Side Instruments,Crops,Monitoring & Management,France,Gedia Energies,4.08,France,FR,FRA,250,ISO 3166-2:FR,Europe,Western Europe,150,155,4080000,Europe
371,Demetria,Crops,Biotech,Colombia,"Celeritas, Mercantil Colpatria",4.45,Colombia,CO,COL,170,ISO 3166-2:CO,Americas,South America,19,5,4450000,South America
372,DeNova,"Livestock, Poultry, & Meats",Biotech,Canada,"Canada's Ocean Supercluster, Sandpiper Ventures",2.6,Canada,CA,CAN,124,ISO 3166-2:CA,Americas,Northern America,19,21,2600000,North America
373,desamis,"Livestock, Poultry, & Meats",Monitoring & Management,Japan,"Nakata Asset Management, Soara Capital Strategies, ASTMAX, Mitsubishi UFJ Capital, SBI Investment, TUSIMCo",1.27,Japan,JP,JPN,392,ISO 3166-2:JP,Asia,Eastern Asia,142,30,1270000,Asia
374,Descartes Labs,Crops,Monitoring & Management,United States,"Correlation Ventures, Crosslink Capital, Cultivian Sandbox, Data Collective, TenOneTen Ventures, ValueStream, New Mexico Economic Development Department, Defense Advanced Research Projects Agency, Cargill, March Capital Partners, Plug and Play Accelerator, Ajax Strategies, Union Grove Venture Partners, AWS Space Accelerator",58.46,United States,US,USA,840,ISO 3166-2:US,Americas,Northern America,19,21,58460000,North America
375,deVGen,Crops,Biotech,Belgium,"Abingworth, Advent Venture Partners, Biotech Fonds Vlaanderen, Gimv, ING, KBC Group, Life Sciences Partners, Mercator Investments, Capricorn Partners, PolyTechnos Venture-Partners, Syngenta",37.1,Belgium,BE,BEL,56,ISO 3166-2:BE,Europe,Western Europe,150,155,37100000,Europe
376,Digi Rodeo,"Livestock, Poultry, & Meats",Monitoring & Management,Argentina,The Yield Lab,0.1,Argentina,AR,ARG,32,ISO 3166-2:AR,Americas,South America,19,5,100000,South America
377,Digital Grain Elevator,Crops,Packing & Supply Chain,United States,,0.06,United States,US,USA,840,ISO 3166-2:US,Americas,Northern America,19,21,60000,North America
378,Digital Green,Crops,Business Planning & Finance,India,"Google.org, Walmart.org",0.48,India,IN,IND,356,ISO 3166-2:IN,Asia,Southern Asia,142,34,480000,Asia
379,DirectFood.store,Multi-faceted,Distribution & Sales,Canada,Digital Technology Supercluster,0.76,Canada,CA,CAN,124,ISO 3166-2:CA,Americas,Northern America,19,21,760000,North America
380,DIT Technologies,"Livestock, Poultry, & Meats",Monitoring & Management,Australia,Australia Entrepreneurs' Programme,0.82,Australia,AU,AUS,36,ISO 3166-2:AU,Oceania,Australia and New Zealand,9,53,820000,Oceania
381,DroneSeed,Crops,Monitoring & Management,United States,"Techstars, Social Capital, SXSW, Elemental Excelerator, 10X Capital, Ashley Mayer, Awesome People Ventures, DBL Partners, Flight Ventures, Gaingels, HBS Alumni Angels Association, Seven Seven Six, Tobi Lutke",41.39,United States,US,USA,840,ISO 3166-2:US,Americas,Northern America,19,21,41390000,North America
382,Droni Tech,Crops,Monitoring & Management,India,Eagle Group,0.5,India,IN,IND,356,ISO 3166-2:IN,Asia,Southern Asia,142,34,500000,Asia
383,Dryland Genetics,Crops,Biotech,United States,"Next Level Ventures, Stine Seed",3.8,United States,US,USA,840,ISO 3166-2:US,Americas,Northern America,19,21,3800000,North America
384,Dynamic Motion,"Livestock, Poultry, & Meats",Monitoring & Management,United States,"gBETA, Innova Memphis, Invest Nebraska",1,United States,US,USA,840,ISO 3166-2:US,Americas,Northern America,19,21,1000000,North America
385,Dynaspace,Fishing & Seafood,Monitoring & Management,Norway,"Hatch, Grunderhub, Innovation Norway, VIS, Planet 9 Venture",0.61,Norway,NO,NOR,578,ISO 3166-2:NO,Europe,Northern Europe,150,154,610000,Europe
386,E Green Global,Crops,Biotech,South Korea,"Korea Development Bank, SK Group, YellowDog, ADB Ventures",15,South Korea,KR,KOR,410,ISO 3166-2:KR,Asia,Eastern Asia,142,30,15000000,Asia
387,E-Farm,Crops,Business Planning & Finance,Puerto Rico,Parallel18,0.04,Puerto Rico,PR,PRI,630,ISO 3166-2:PR,Americas,North America,19,29,40000,North America
388,E-FARM.com,Crops,Distribution & Sales,Germany,"CLAAS, Cremer, WiT Ventures",5.3,Germany,DE,DEU,276,ISO 3166-2:DE,Europe,Western Europe,150,155,5300000,Europe
389,Eagle Genomics,Multi-faceted,Biotech,United Kingdom,"Cambridge Angels, Cambridge Capital Group, Jonathan Milner, London Business Angels, Midven, UK Innovation & Science Seed Fund, ACF Investors, Innovate UK, Microsoft ScaleUp, Environmental Technologies Fund, Microsoft AI Factory, Tech Nation, Granpool Innovative Investments",18.05,United Kingdom,GB,GBR,826,ISO 3166-2:GB,Europe,Northern Europe,150,154,18050000,Europe
390,eAgronom,Crops,Monitoring & Management,Estonia,"Aivar Berzin, Andres Kull, Andrus Purde, Black Pearls VC, Martin Tajur, Ragnar Sass, Specialist VC, TMT Investments, Trind Ventures, Cats.vc, Iron Wolf Capital, Martin Villig, Superangel, Taavi Tamkivi, Yolo Investments, ZGI Capital, European Commission Grant",10.62,Estonia,EE,EST,233,ISO 3166-2:EE,Europe,Northern Europe,150,154,10620000,Europe
391,Earth Networks,Crops,Business Planning & Finance,United States,"HarbourVest Partners, Polaris Partners, Sequoia Capital, Patriot Capital, Advanced Environmental Monitoring",46.9,United States,US,USA,840,ISO 3166-2:US,Americas,Northern America,19,21,46900000,North America
392,EarthOptics,Crops,Monitoring & Management,United States,"AgTech Accelerator, FHB Ventures, Leaps by Bayer, Middleland Capital, Route 66 Ventures, S2G Ventures",15.25,United States,US,USA,840,ISO 3166-2:US,Americas,Northern America,19,21,15250000,North America
393,EarthSense,Crops,Monitoring & Management,United States,"AgLaunch, FoodBytes!, Innova Memphis, John Deere, Wells Fargo Innovation Incubator",1,United States,US,USA,840,ISO 3166-2:US,Americas,Northern America,19,21,1000000,North America
394,East West Agro,Crops,Business Planning & Finance,Lithuania,"Swedbank, Practica Capital",6.72,Lithuania,LT,LTU,440,ISO 3166-2:LT,Europe,Northern Europe,150,154,6720000,Europe
395,Eat Just,"Livestock, Poultry, & Meats",Biotech,United States,"Bill Gates, Khosla Ventures, Founders Fund, AME Cloud Ventures, Ash Patel, Collab+Currency, Eagle Cliff Partners, Horizons Ventures, Jessica Powell, New Ground Ventures, Scott Banister, BlackPine Private Equity Partners, Demis Hassabis, Eduardo Saverin, Marc Benioff, Mustafa Suleyman, Blue Horizon, Radicle Impact, Global Tech Ventures, Good Startup, Level One Fund, Powerplant Ventures, Cercano Management, Charlesbank Capital Partners, Qatar Investment Authority, Red Lions Capital, Graphene Ventures, K3 Ventures, UBS O'Connor, WP Global Partners, AIV Capital, CULT Food Science, Resilience Capital Partners, Resilience Reserve",706.6,United States,US,USA,840,ISO 3166-2:US,Americas,Northern America,19,21,706600000,North America
396,Eat Rustic,Crops,Distribution & Sales,Russian Federation,"Some Random VC, Vladimir Bakuteyev",0.3,Russian Federation,RU,RUS,643,ISO 3166-2:RU,Europe,Eastern Europe,150,151,300000,Europe
397,EAVISION,Crops,Monitoring & Management,China,"CITIC Agriculture Fund, Talent Capital, BASF, Bits x Bites, Chongshan Capital, Continental Grain, Oriza Holdings, Pagoda, Temasek, Yongxin Fangzhou, Zhidao Capital",30,China,CN,CHN,156,ISO 3166-2:CN,Asia,Eastern Asia,142,30,30000000,Asia
398,ec2ec,Crops,Monitoring & Management,Spain,Max Rudman,1.71,Spain,ES,ESP,724,ISO 3166-2:ES,Europe,Southern Europe,150,39,1710000,Europe
399,Ecoation Innovative Solutions,Crops,Monitoring & Management,Canada,"Angel Forum Vancouver, Creative Destruction Lab, Pyfera Capital, Innovate BC, Barney Pell, Pallasite Ventures, Sustainable Development Technology Canada, Floridienne",17.92,Canada,CA,CAN,124,ISO 3166-2:CA,Americas,Northern America,19,21,17920000,North America
400,Ecodudu,Crops,Monitoring & Management,Kenya,"GreenTec Capital Partners, Wimbart, @iBizAfrica, Pangea",0.1,Kenya,KE,KEN,404,ISO 3166-2:KE,Africa,Eastern Africa,2,14,100000,Africa
401,EcoPackers Inc.,Crops,Packing & Supply Chain,Canada,"Golden Ventures, Horizons Ventures",4.3,Canada,CA,CAN,124,ISO 3166-2:CA,Americas,Northern America,19,21,4300000,North America
402,ecoRobotix,Crops,Monitoring & Management,Switzerland,"4FO Venture Partners, Business Angels Switzerland, investiere, Foundation for Technological Innovation, BASF Venture Capital, Capagro Innovation, Swisscom Startup Challenge, 4FO Ventures Partners, Swisscom Ventures, Verve Ventures",28.91,Switzerland,CH,CHE,756,ISO 3166-2:CH,Europe,Western Europe,150,155,28910000,Europe
403,Ecto,Fishing & Seafood,Monitoring & Management,United States,"The Yield Lab, Founder.org, Vodia Capital, Aqua-Spark, U.S. Department of Agriculture, National Science Foundation, Paycheck Protection Program",14.82,United States,US,USA,840,ISO 3166-2:US,Americas,Northern America,19,21,14820000,North America
404,,"Livestock, Poultry, & Meats",Biotech,United States,"Aqua-Spark, Rabo Frontier Ventures, Seventure Partners, Vodia Ventures, Yield Lab Europe",7,United States,US,USA,840,ISO 3166-2:US,Americas,Northern America,19,21,7000000,North America
405,Eden Green Technology,Crops,Monitoring & Management,United States,,16,United States,US,USA,840,ISO 3166-2:US,Americas,Northern America,19,21,16000000,North America
406,Eden Towers,Crops,Monitoring & Management,Australia,Government of Western Australia,0.26,Australia,AU,AUS,36,ISO 3166-2:AU,Oceania,Australia and New Zealand,9,53,260000,Oceania
407,EdenShield,Crops,Biotech,Israel,"The Trendlines Group, OurCrowd",3,Israel,IL,ISR,376,ISO 3166-2:IL,Asia,Western Asia,142,145,3000000,Asia
408,edete Precision Agriculture Technologies,Crops,Monitoring & Management,Israel,"Israel Innovation Authority, Kibbutz Malkia",3,Israel,IL,ISR,376,ISO 3166-2:IL,Asia,Western Asia,142,145,3000000,Asia
409,Edible Garden,Crops,Monitoring & Management,United States,"Unrivaled Brands, Paycheck Protection Program",3.78,United States,US,USA,840,ISO 3166-2:US,Americas,Northern America,19,21,3780000,North America
410,Edison Agrosciences,Crops,Biotech,United States,"BioGenerator, Missouri Technology Corporation, Arch Grants",0.85,United States,US,USA,840,ISO 3166-2:US,Americas,Northern America,19,21,850000,North America
411,EditForce,Crops,Biotech,Japan,"KISCO, QB Capital, University of Tokyo Edge Capital, ITOCHU Technology Ventures, Japan Science and Technology Agency, K4 Ventures, Newton Biocapital, Global Brain, KDDI Open Innovation Fund, FFG Venture Business Partners, MP Healthcare Venture Management, Yoshimei",23.82,Japan,JP,JPN,392,ISO 3166-2:JP,Asia,Eastern Asia,142,30,23820000,Asia
412,EDN,Crops,Monitoring & Management,United States,Techstars,6.5,United States,US,USA,840,ISO 3166-2:US,Americas,Northern America,19,21,6500000,North America
413,Edyn,Crops,Monitoring & Management,United States,"Y Combinator, Kickstarter, Indicator Ventures, Pegasus Tech Ventures, QueensBridge Venture Partners, Sinovation Ventures, Morningside Technology Ventures, THRIVE Accelerator, Orange Fab",4.24,United States,US,USA,840,ISO 3166-2:US,Americas,Northern America,19,21,4240000,North America
